{
  "id": 1,
  "name": "PartEditor",
  "author": "Cucumber Space",
  "version": "1.0.0",
  "description": "The parts editor is capable of editing the width, height, rotation, and width of the top and bottom parts of the components.",
  "type": "mod",
  "dependencies": [1],
  "conflicts": [],
  "download": "https://release-assets.githubusercontent.com/github-production-release-asset/508282577/9fd4b236-56f0-424c-83c4-8ee8192de572?sp=r&sv=2018-11-09&sr=b&spr=https&se=2026-06-22T00%3A50%3A36Z&rscd=attachment%3B+filename%3DPartEditor.dll&rsct=application%2Foctet-stream&skoid=96c2d410-5711-43a1-aedd-ab1947aa7ab0&sktid=398a6654-997b-47e9-b12b-9515b896b4de&skt=2026-06-21T23%3A49%3A45Z&ske=2026-06-22T00%3A50%3A36Z&sks=b&skv=2018-11-09&sig=geSvCmeHp9psDER9sJ64ANb%2BUpYu6DwnunPuZoKjM04%3D&jwt=eyJ0eXAiOiJKV1QiLCJhbGciOiJIUzI1NiJ9.eyJpc3MiOiJnaXRodWIuY29tIiwiYXVkIjoicmVsZWFzZS1hc3NldHMuZ2l0aHVidXNlcmNvbnRlbnQuY29tIiwia2V5Ijoia2V5MSIsImV4cCI6MTc4MjA4NjkzNSwibmJmIjoxNzgyMDg2NjM1LCJwYXRoIjoicmVsZWFzZWFzc2V0cHJvZHVjdGlvbi5ibG9iLmNvcmUud2luZG93cy5uZXQifQ.2FXCOHt2kyOLjaRsTggtPS0FSG6rdEZ8thqW-uj9pAQ&response-content-disposition=attachment%3B%20filename%3DPartEditor.dll&response-content-type=application%2Foctet-stream",
  "size": "19KB"
}